{
  "$schema": "../../schemas/case.schema.json",
  "schema": "decision-archaeology.case@v0",
  "template": "decision-archaeology.case-template@v0.1.0",
  "id": "barite-bid-rigging-2025",
  "title": "Barite tenders and AMCU decision 535-r",
  "status": "active",
  "visibility": "public",
  "summary": "Which parts of AMCU decision 535-r can be reconstructed from the public procurement record, and which proposed shortcuts are refuted by that record?",
  "paths": {
    "sources": "sources/",
    "observations": "observations/",
    "claims": "claims/",
    "decisions": "decisions/",
    "checks": "checks/",
    "receipts": "receipts/",
    "artifacts": "artifacts/",
    "exclusions": "exclusions.md"
  },
  "dependencies": [
    {
      "id": "python",
      "version": "3.13.15",
      "role": "standard-library offline and live case checks"
    },
    {
      "id": "sigma-glyph",
      "version": "0.6.7",
      "role": "pinned Book I evaluator for the exact-sum receipt"
    },
    {
      "id": "decision-archaeology.sigma-money-add-eq",
      "version": "v0",
      "role": "application-owned canonical encoding of the exact-sum claim"
    }
  ]
}
